{
  "session_id": "79914c80-e817-42d1-9d47-7f7579f79390",
  "session_type": "build",
  "timestamp": "2025-12-12T10:53:22.655568Z",
  "agent_id": "Agent-1",
  "metadata": {
    "agent_name": "Test Agent",
    "current_mission": "Test Mission",
    "completed_tasks": [],
    "achievements": [],
    "duration_minutes": 13973
  },
  "source_data": {
    "repo_path": "C:\\Users\\USER\\AppData\\Local\\Temp\\tmpc62x6_3o",
    "git_commits": [],
    "files_changed": []
  },
  "artifacts": {},
  "pipeline_status": {
    "build_artifact": "pending",
    "trade_artifact": "not_applicable",
    "life_aria_artifact": "not_applicable"
  }
}