{
  "session_id": "633cb6a5-70c4-44cd-b00d-299845fa2095",
  "session_type": "build",
  "timestamp": "2025-12-12T10:53:23.247142Z",
  "agent_id": "Agent-1",
  "metadata": {
    "agent_name": "Test Agent",
    "current_mission": "Test Mission",
    "completed_tasks": [],
    "achievements": [],
    "duration_minutes": 13973
  },
  "source_data": {
    "repo_path": "C:\\Users\\USER\\AppData\\Local\\Temp\\tmpqy_b7jky",
    "git_commits": [],
    "files_changed": []
  },
  "artifacts": {},
  "pipeline_status": {
    "build_artifact": "pending",
    "trade_artifact": "not_applicable",
    "life_aria_artifact": "not_applicable"
  }
}