{
  "session_id": "7e112553-b089-4397-bc41-83781378536c",
  "session_type": "build",
  "timestamp": "2025-12-02T12:44:07.817471Z",
  "agent_id": "Agent-1",
  "metadata": {
    "agent_name": "Test Agent",
    "current_mission": "Test Mission",
    "completed_tasks": [],
    "achievements": [],
    "duration_minutes": -315
  },
  "source_data": {
    "repo_path": "C:\\Users\\USER\\AppData\\Local\\Temp\\tmphzz3__2y",
    "git_commits": [],
    "files_changed": []
  },
  "artifacts": {},
  "pipeline_status": {
    "build_artifact": "pending",
    "trade_artifact": "not_applicable",
    "life_aria_artifact": "not_applicable"
  }
}