{
  "session_id": "a61004c6-a427-4304-89ce-1c2d28e45918",
  "session_type": "build",
  "timestamp": "2025-12-02T16:21:25.521203Z",
  "agent_id": "Agent-1",
  "metadata": {
    "agent_name": "Test Agent",
    "current_mission": "Test Mission",
    "completed_tasks": [],
    "achievements": [],
    "duration_minutes": -98
  },
  "source_data": {
    "repo_path": "C:\\Users\\USER\\AppData\\Local\\Temp\\tmpsqixo8wf",
    "git_commits": [],
    "files_changed": []
  },
  "artifacts": {},
  "pipeline_status": {
    "build_artifact": "pending",
    "trade_artifact": "not_applicable",
    "life_aria_artifact": "not_applicable"
  }
}