{
  "session_id": "8fbfcbfe-15fd-4df7-9311-3237877f7b01",
  "session_type": "build",
  "timestamp": "2025-12-03T01:37:46.712093Z",
  "agent_id": "Agent-1",
  "metadata": {
    "agent_name": "Test Agent",
    "current_mission": "Test Mission",
    "completed_tasks": [],
    "achievements": [],
    "duration_minutes": 457
  },
  "source_data": {
    "repo_path": "C:\\Users\\USER\\AppData\\Local\\Temp\\tmpafvhnjpj",
    "git_commits": [],
    "files_changed": []
  },
  "artifacts": {},
  "pipeline_status": {
    "build_artifact": "pending",
    "trade_artifact": "not_applicable",
    "life_aria_artifact": "not_applicable"
  }
}