{
  "session_id": "a2-phase2-arch-2025-12-02",
  "session_type": "build",
  "timestamp": "2025-12-02T05:16:00Z",
  "agent_id": "Agent-2",
  "metadata": {
    "duration_minutes": 45,
    "files_changed": 3,
    "commits": 0,
    "lines_added": 1200,
    "lines_removed": 0
  },
  "source_data": {
    "repo_path": "D:/Agent_Cellphone_V2_Repository",
    "git_commits": [],
    "conversations": [
      {
        "source": "captain",
        "content": "Phase 2 Architecture Blueprint assignment - design pipeline architecture, interface contracts, implementation guidance",
        "timestamp": "2025-12-02T03:17:00Z"
      }
    ],
    "deliverables": [
      "systems/output_flywheel/ARCHITECTURE_PHASE2_PIPELINES.md",
      "systems/output_flywheel/pipelines/PIPELINE_INTERFACES.md",
      "systems/output_flywheel/IMPLEMENTATION_GUIDANCE_AGENT1.md"
    ]
  },
  "artifacts": {},
  "pipeline_status": {
    "build_artifact": "pending",
    "trade_artifact": "not_applicable",
    "life_aria_artifact": "not_applicable"
  }
}

